{"capability_id":"prime.long-session-continuity","consumes_artifacts":[],"consumes_events":[],"emits_events":[],"kind":"capability","produces_artifacts":["application/vnd.asterion.prime.p4-native-receipt+json"],"protocol":"asterion.capability/v1","provides_capabilities":["prime.long-session-continuity"],"requires_capabilities":["prime.tool.ipython"],"requires_policies":[],"version":"1.0.0"}
