{"capability_id":"protocol.observability","consumes_artifacts":["application/vnd.dci.research.answer+json","application/vnd.dci.research.locations+json","application/vnd.dci.research.trajectory+json","application/vnd.dci.verdict+json"],"consumes_events":["evaluation.completed","research.completed"],"emits_events":["audit.capability-observed"],"kind":"observability","produces_artifacts":[],"protocol":"asterion.capability/v1","provides_capabilities":[],"requires_capabilities":["research.local-corpus"],"requires_policies":["policy.local-corpus"],"version":"1.0.0"}
