{"capability_id":"dci.research","consumes_artifacts":[],"consumes_events":[],"emits_events":["research.completed"],"kind":"capability","produces_artifacts":["application/vnd.dci.research+json"],"protocol":"asterion.capability/v1","provides_capabilities":["research.local-corpus"],"requires_capabilities":["filesystem.read"],"requires_policies":["policy.local-corpus"],"version":"1.0.0"}
