{"capability_id":"dci.benchmark","consumes_artifacts":["application/vnd.dci.verdict+json"],"consumes_events":["evaluation.completed"],"emits_events":["benchmark.completed"],"kind":"evaluation","produces_artifacts":["application/vnd.dci.benchmark+json"],"protocol":"asterion.capability/v1","provides_capabilities":[],"requires_capabilities":["research.local-corpus"],"requires_policies":["policy.local-corpus"],"version":"1.0.0"}
