{
  "protocol": "asterion.capability/v1",
  "capability_id": "workflow.code-quality",
  "version": "1.0.0",
  "kind": "workflow",
  "provides_capabilities": ["workflow.code-quality"],
  "requires_capabilities": ["executor.controlled", "filesystem.read"],
  "requires_policies": ["policy.controlled-code-check"],
  "emits_events": ["workflow.code-quality.completed"],
  "consumes_events": [],
  "produces_artifacts": ["application/vnd.dci.code-quality+json"],
  "consumes_artifacts": []
}
