{"capability_id":"prime.bounded-autonomy","consumes_artifacts":[],"consumes_events":[],"emits_events":[],"kind":"capability","produces_artifacts":["application/vnd.asterion.prime.p5-native-receipt+json"],"protocol":"asterion.capability/v1","provides_capabilities":["prime.bounded-autonomy"],"requires_capabilities":["prime.ipython","prime.p5-oracle","prime.pi-extension","prime.private-trace","prime.session-backend"],"requires_policies":[],"version":"1.0.0"}
