{"capability_id":"prime.continual-improvement","consumes_artifacts":[],"consumes_events":[],"emits_events":[],"kind":"capability","produces_artifacts":["application/vnd.asterion.prime.p6-native-receipt+json"],"protocol":"asterion.capability/v1","provides_capabilities":["prime.continual-improvement"],"requires_capabilities":["prime.candidate-store","prime.p6-oracle","prime.pi-extension","prime.private-trace","prime.session-backend"],"requires_policies":[],"version":"1.0.0"}
