{"capability_id":"dci.export","consumes_artifacts":["application/vnd.dci.analysis+json"],"consumes_events":["analysis.completed"],"emits_events":["export.completed"],"kind":"evaluation","produces_artifacts":["application/vnd.dci.export+json"],"protocol":"asterion.capability/v1","provides_capabilities":[],"requires_capabilities":["research.local-corpus"],"requires_policies":["policy.local-corpus"],"version":"1.0.0"}
