{"capability_id":"dci.evaluation","consumes_artifacts":["application/vnd.dci.research.answer+json","application/vnd.dci.research.locations+json","application/vnd.dci.research.trajectory+json"],"consumes_events":["research.completed"],"emits_events":["evaluation.completed"],"kind":"evaluation","produces_artifacts":["application/vnd.dci.verdict+json"],"protocol":"asterion.capability/v1","provides_capabilities":[],"requires_capabilities":["research.local-corpus"],"requires_policies":["policy.local-corpus"],"version":"1.0.0"}
