{"capability_id":"observability.execution-audit","consumes_artifacts":["application/vnd.dci.code-quality+json"],"consumes_events":["workflow.code-quality.completed"],"emits_events":["audit.execution-recorded"],"kind":"observability","produces_artifacts":["application/vnd.dci.execution-audit+json"],"protocol":"asterion.capability/v1","provides_capabilities":[],"requires_capabilities":["workflow.code-quality"],"requires_policies":["policy.controlled-code-check"],"version":"1.0.0"}
