{
  "protocol": "asterion.capability/v1",
  "capability_id": "dci.analysis",
  "version": "1.0.0",
  "kind": "evaluation",
  "provides_capabilities": [],
  "requires_capabilities": ["research.local-corpus"],
  "requires_policies": ["policy.local-corpus"],
  "emits_events": ["analysis.completed"],
  "consumes_events": ["benchmark.completed"],
  "produces_artifacts": ["application/vnd.dci.analysis+json"],
  "consumes_artifacts": ["application/vnd.dci.benchmark+json"]
}
