{
  "protocol": "asterion.capability/v1",
  "capability_id": "example.unicode-order",
  "version": "1.0.0",
  "kind": "capability",
  "provides_capabilities": ["\uE000", "\uD800\uDC00"],
  "requires_capabilities": [],
  "requires_policies": [],
  "emits_events": [],
  "consumes_events": [],
  "produces_artifacts": [],
  "consumes_artifacts": []
}
