{"capability_id":"prime.programmatic-long-context","consumes_artifacts":[],"consumes_events":[],"emits_events":[],"kind":"capability","produces_artifacts":["application/vnd.asterion.prime.p2-native-receipt+json"],"protocol":"asterion.capability/v1","provides_capabilities":["prime.programmatic-long-context"],"requires_capabilities":["prime.tool.ipython"],"requires_policies":[],"version":"1.0.0"}
