{"capability_id":"evaluation.code-quality","consumes_artifacts":["application/vnd.dci.code-quality+json"],"consumes_events":["workflow.code-quality.completed"],"emits_events":[],"kind":"evaluation","produces_artifacts":["application/vnd.dci.code-quality-verdict+json"],"protocol":"asterion.capability/v1","provides_capabilities":[],"requires_capabilities":["workflow.code-quality"],"requires_policies":["policy.controlled-code-check"],"version":"1.0.0"}
