{"capability_id":"workflow.code-quality","consumes_artifacts":[],"consumes_events":[],"emits_events":["workflow.code-quality.completed"],"kind":"workflow","produces_artifacts":["application/vnd.dci.code-quality+json"],"protocol":"asterion.capability/v1","provides_capabilities":["workflow.code-quality"],"requires_capabilities":["executor.controlled","filesystem.read"],"requires_policies":["policy.controlled-code-check"],"version":"1.0.0"}
